{
  "schemaVersion": 1,
  "id": "surface-canvas",
  "title": "Surface canvas",
  "goal": "Paint onto an EditableImage attached to a Part's SurfaceGui.",
  "tags": [
    "editableimage",
    "surfacegui",
    "interactive"
  ],
  "steps": [
    {
      "id": "s1-intro",
      "type": "narrative",
      "body": "`EditableImage` works just as well behind a `SurfaceGui` as behind\na `ScreenGui`. We'll put an EditableImage on the front face of a\nPart and paint onto it with the mouse \u2014 like a wall-mounted\nwhiteboard in 3D space.\n"
    },
    {
      "id": "s2-canvas",
      "type": "scripted",
      "body": "A flat Part to paint on.",
      "action": {
        "op": "createInstance",
        "class": "Part",
        "parent": "Workspace",
        "props": {
          "Name": "Canvas",
          "Anchored": true,
          "Size": [
            16,
            10,
            1
          ],
          "Position": [
            0,
            6,
            -6
          ],
          "Material": "Enum.Material.SmoothPlastic",
          "Color": [
            0.9,
            0.9,
            0.9
          ]
        }
      },
      "focus": {
        "selection": "Workspace.Canvas"
      }
    },
    {
      "id": "s3-surfacegui",
      "type": "scripted",
      "body": "SurfaceGui on the front face.",
      "action": {
        "op": "createInstance",
        "class": "SurfaceGui",
        "parent": "Workspace.Canvas",
        "props": {
          "Name": "SurfaceGui",
          "Face": "Enum.NormalId.Front",
          "CanvasSize": [
            512,
            320
          ],
          "PixelsPerStud": 40
        }
      },
      "focus": {
        "selection": "Workspace.Canvas.SurfaceGui"
      }
    },
    {
      "id": "s4-image",
      "type": "scripted",
      "body": "ImageLabel that fills the SurfaceGui.",
      "action": {
        "op": "createInstance",
        "class": "ImageLabel",
        "parent": "Workspace.Canvas.SurfaceGui",
        "props": {
          "Name": "Image",
          "Size": [
            1,
            0,
            1,
            0
          ],
          "BackgroundTransparency": 1
        }
      },
      "focus": {
        "selection": "Workspace.Canvas.SurfaceGui.Image"
      }
    },
    {
      "id": "s5-paint",
      "type": "codeEdit",
      "body": "The Paint LocalScript creates an EditableImage, checks that\n`Mouse.Target` is our Part before painting, and maps the GUI-space\nmouse position to pixel coordinates. The brush color rainbows over\ntime \u2014 click & drag to paint.\n",
      "explain": "`Mouse.Target` is the part under the cursor in 3D space \u2014 cheap\nway to gate painting to only when the cursor is over the canvas.\nFor more accurate mapping on arbitrary faces, use `SurfaceGui`'s\nlocal-space mouse position via a `BillboardGui`-style raycast.\n",
      "target": {
        "path": "Workspace.Canvas.SurfaceGui.Image.Paint",
        "create": true,
        "class": "LocalScript"
      },
      "source": "local AssetService = game:GetService(\"AssetService\")\nlocal UserInputService = game:GetService(\"UserInputService\")\nlocal Players = game:GetService(\"Players\")\n\nlocal W, H = 512, 512\nlocal BRUSH_R = 12\n\nlocal label = script.Parent\nlocal img = AssetService:CreateEditableImage({ Size = Vector2.new(W, H) })\nimg:DrawRectangle(Vector2.zero, img.Size, Color3.new(1, 1, 1), 0, Enum.ImageCombineType.Overwrite)\nlabel.ImageContent = Content.fromObject(img)\n\nlocal surfaceGui = label.Parent\nlocal part = surfaceGui.Adornee or surfaceGui.Parent\n\nlocal player = Players.LocalPlayer\nlocal mouse = player:GetMouse()\n\nlocal painting = false\n\nlocal function tryPaint()\n  if mouse.Target ~= part then return end\n  local ap, as = label.AbsolutePosition, label.AbsoluteSize\n  local fx = (mouse.X - ap.X) / as.X\n  local fy = (mouse.Y - ap.Y) / as.Y\n  if fx < 0 or fx > 1 or fy < 0 or fy > 1 then return end\n  img:DrawCircle(\n    Vector2.new(fx * W, fy * H), BRUSH_R,\n    Color3.fromHSV(tick() % 1, 0.8, 1),\n    0, Enum.ImageCombineType.AlphaBlend\n  )\nend\n\nUserInputService.InputBegan:Connect(function(input, gp)\n  if gp then return end\n  if input.UserInputType == Enum.UserInputType.MouseButton1 then\n    painting = true\n    tryPaint()\n  end\nend)\n\nUserInputService.InputEnded:Connect(function(input)\n  if input.UserInputType == Enum.UserInputType.MouseButton1 then\n    painting = false\n  end\nend)\n\nmouse.Move:Connect(function()\n  if painting then tryPaint() end\nend)\n",
      "focus": {
        "script": {
          "path": "Workspace.Canvas.SurfaceGui.Image.Paint"
        }
      }
    },
    {
      "id": "s6-playtest",
      "type": "narrative",
      "body": "Press \u25b6 **Play** (F5). Walk up to the white canvas and click & drag\nto paint rainbow strokes directly onto the Part. Shift+F5 to stop.\n"
    }
  ]
}