{
  "schemaVersion": 1,
  "id": "paint-tool",
  "title": "Paint tool",
  "goal": "Draw strokes into an EditableImage with the mouse.",
  "tags": [
    "editableimage",
    "interactive",
    "tools"
  ],
  "steps": [
    {
      "id": "s1-intro",
      "type": "narrative",
      "body": "`EditableImage:DrawCircle` stamps a filled circle at a pixel\nposition. Combine it with mouse drag tracking and you have a\nbasic one-color paint brush.\n"
    },
    {
      "id": "s2-gui",
      "type": "scripted",
      "body": "ScreenGui host.",
      "action": {
        "op": "createInstance",
        "class": "ScreenGui",
        "parent": "StarterGui",
        "props": {
          "Name": "PaintGui",
          "ResetOnSpawn": false
        }
      },
      "focus": {
        "selection": "StarterGui.PaintGui"
      }
    },
    {
      "id": "s3-canvas",
      "type": "scripted",
      "body": "White canvas.",
      "action": {
        "op": "createInstance",
        "class": "ImageLabel",
        "parent": "StarterGui.PaintGui",
        "props": {
          "Name": "Canvas",
          "Size": [
            0,
            512,
            0,
            512
          ],
          "Position": [
            0.5,
            -256,
            0.5,
            -256
          ],
          "BackgroundColor3": [
            1,
            1,
            1
          ],
          "BorderSizePixel": 2
        }
      },
      "focus": {
        "selection": "StarterGui.PaintGui.Canvas"
      }
    },
    {
      "id": "s4-paint",
      "type": "codeEdit",
      "body": "Add the Paint LocalScript. Mouse down starts a stroke; mouse move\nstamps a circle per event. Mouse up ends the stroke.\n",
      "explain": "This emits one brush stamp per `InputChanged` event rather than\ninterpolating between points, so fast drags produce dotted lines.\nFor smooth strokes, interpolate with `DrawLine` or multiple\ncircles between the previous and current positions.\n",
      "target": {
        "path": "StarterGui.PaintGui.Canvas.Paint",
        "create": true,
        "class": "LocalScript"
      },
      "source": "local AssetService = game:GetService(\"AssetService\")\nlocal UserInputService = game:GetService(\"UserInputService\")\n\nlocal W, H = 512, 512\nlocal BRUSH_RADIUS = 8\nlocal COLOR = Color3.fromRGB(255, 60, 60)\n\nlocal label = script.Parent\nlocal img = AssetService:CreateEditableImage({ Size = Vector2.new(W, H) })\nimg:DrawRectangle(Vector2.zero, img.Size, Color3.new(1, 1, 1), 0, Enum.ImageCombineType.Overwrite)\nlabel.ImageContent = Content.fromObject(img)\n\nlocal painting = false\n\nlocal function toPixel(screenPos)\n  local ap, as = label.AbsolutePosition, label.AbsoluteSize\n  return Vector2.new(\n    math.floor((screenPos.X - ap.X) / as.X * W),\n    math.floor((screenPos.Y - ap.Y) / as.Y * H)\n  )\nend\n\nlabel.InputBegan:Connect(function(input)\n  if input.UserInputType == Enum.UserInputType.MouseButton1 then\n    painting = true\n    img:DrawCircle(toPixel(input.Position), BRUSH_RADIUS, COLOR, 0, Enum.ImageCombineType.AlphaBlend)\n  end\nend)\n\nUserInputService.InputEnded:Connect(function(input)\n  if input.UserInputType == Enum.UserInputType.MouseButton1 then\n    painting = false\n  end\nend)\n\nUserInputService.InputChanged:Connect(function(input)\n  if painting and input.UserInputType == Enum.UserInputType.MouseMovement then\n    img:DrawCircle(toPixel(input.Position), BRUSH_RADIUS, COLOR, 0, Enum.ImageCombineType.AlphaBlend)\n  end\nend)\n",
      "focus": {
        "script": {
          "path": "StarterGui.PaintGui.Canvas.Paint"
        }
      }
    },
    {
      "id": "s5-playtest",
      "type": "narrative",
      "body": "Press \u25b6 **Play** (F5). Click and drag in the canvas to paint red\nstrokes. Fast drags will look dotted \u2014 see the `explain` panel for\nthe fix.\n"
    }
  ]
}